{
  "$schema": "http://json-schema.org/draft-04/schema#",
  "definitions": {},
  "id": "http://example.com/example.json",
  "items": {
    "id": "/items",
    "properties": {
      "artist": {
        "id": "/items/properties/artist",
        "type": "string"
      },
      "dataPainted": {
        "id": "/items/properties/dataPainted",
        "type": "string"
      },
      "imgURL": {
        "id": "/items/properties/imgURL",
        "type": "string"
      },
      "title": {
        "id": "/items/properties/title",
        "type": "string"
      }
    },
    "type": "object"
  },
  "type": "array"
}